{
  "teams": [
    {"team_id": "nba-ATL", "city": "Atlanta", "name": "Hawks", "abbreviation": "ATL", "conference": "East", "division": "Southeast"},
    {"team_id": "nba-BOS", "city": "Boston", "name": "Celtics", "abbreviation": "BOS", "conference": "East", "division": "Atlantic"},
    {"team_id": "nba-BKN", "city": "Brooklyn", "name": "Nets", "abbreviation": "BKN", "conference": "East", "division": "Atlantic"},
    {"team_id": "nba-CHA", "city": "Charlotte", "name": "Hornets", "abbreviation": "CHA", "conference": "East", "division": "Southeast"},
    {"team_id": "nba-CHI", "city": "Chicago", "name": "Bulls", "abbreviation": "CHI", "conference": "East", "division": "Central"},
    {"team_id": "nba-CLE", "city": "Cleveland", "name": "Cavaliers", "abbreviation": "CLE", "conference": "East", "division": "Central"},
    {"team_id": "nba-DAL", "city": "Dallas", "name": "Mavericks", "abbreviation": "DAL", "conference": "West", "division": "Southwest"},
    {"team_id": "nba-DEN", "city": "Denver", "name": "Nuggets", "abbreviation": "DEN", "conference": "West", "division": "Northwest"},
    {"team_id": "nba-DET", "city": "Detroit", "name": "Pistons", "abbreviation": "DET", "conference": "East", "division": "Central"},
    {"team_id": "nba-GSW", "city": "Golden State", "name": "Warriors", "abbreviation": "GSW", "conference": "West", "division": "Pacific"},
    {"team_id": "nba-HOU", "city": "Houston", "name": "Rockets", "abbreviation": "HOU", "conference": "West", "division": "Southwest"},
    {"team_id": "nba-IND", "city": "Indiana", "name": "Pacers", "abbreviation": "IND", "conference": "East", "division": "Central"},
    {"team_id": "nba-LAC", "city": "LA", "name": "Clippers", "abbreviation": "LAC", "conference": "West", "division": "Pacific"},
    {"team_id": "nba-LAL", "city": "Los Angeles", "name": "Lakers", "abbreviation": "LAL", "conference": "West", "division": "Pacific"},
    {"team_id": "nba-MEM", "city": "Memphis", "name": "Grizzlies", "abbreviation": "MEM", "conference": "West", "division": "Southwest"},
    {"team_id": "nba-MIA", "city": "Miami", "name": "Heat", "abbreviation": "MIA", "conference": "East", "division": "Southeast"},
    {"team_id": "nba-MIL", "city": "Milwaukee", "name": "Bucks", "abbreviation": "MIL", "conference": "East", "division": "Central"},
    {"team_id": "nba-MIN", "city": "Minnesota", "name": "Timberwolves", "abbreviation": "MIN", "conference": "West", "division": "Northwest"},
    {"team_id": "nba-NOP", "city": "New Orleans", "name": "Pelicans", "abbreviation": "NOP", "conference": "West", "division": "Southwest"},
    {"team_id": "nba-NYK", "city": "New York", "name": "Knicks", "abbreviation": "NYK", "conference": "East", "division": "Atlantic"},
    {"team_id": "nba-OKC", "city": "Oklahoma City", "name": "Thunder", "abbreviation": "OKC", "conference": "West", "division": "Northwest"},
    {"team_id": "nba-ORL", "city": "Orlando", "name": "Magic", "abbreviation": "ORL", "conference": "East", "division": "Southeast"},
    {"team_id": "nba-PHI", "city": "Philadelphia", "name": "76ers", "abbreviation": "PHI", "conference": "East", "division": "Atlantic"},
    {"team_id": "nba-PHX", "city": "Phoenix", "name": "Suns", "abbreviation": "PHX", "conference": "West", "division": "Pacific"},
    {"team_id": "nba-POR", "city": "Portland", "name": "Trail Blazers", "abbreviation": "POR", "conference": "West", "division": "Northwest"},
    {"team_id": "nba-SAC", "city": "Sacramento", "name": "Kings", "abbreviation": "SAC", "conference": "West", "division": "Pacific"},
    {"team_id": "nba-SAS", "city": "San Antonio", "name": "Spurs", "abbreviation": "SAS", "conference": "West", "division": "Southwest"},
    {"team_id": "nba-TOR", "city": "Toronto", "name": "Raptors", "abbreviation": "TOR", "conference": "East", "division": "Atlantic"},
    {"team_id": "nba-UTA", "city": "Utah", "name": "Jazz", "abbreviation": "UTA", "conference": "West", "division": "Northwest"},
    {"team_id": "nba-WAS", "city": "Washington", "name": "Wizards", "abbreviation": "WAS", "conference": "East", "division": "Southeast"}
  ],
  "source_name": "NBA.com official public team pages",
  "source_url": "https://www.nba.com/teams",
  "as_of_date": "2026-06-25",
  "manual_review_required": true
}
